{
  "id": "bedrock",
  "version": 2,
  "displayName": "AWS Bedrock (OpenAI-compatible)",
  "adapterKind": "openai-compatible",
  "authKinds": [
    "bearer"
  ],
  "endpointKinds": [
    "static"
  ],
  "defaultHeaders": {
    "Content-Type": "application/json"
  },
  "defaultBody": {},
  "requestSchema": [
    {
      "key": "endpointUrl",
      "type": "string",
      "label": "Endpoint URL",
      "description": "Bedrock OpenAI-compatible chat completions URL (region-specific).",
      "required": true,
      "mapsTo": {
        "target": "custom",
        "path": "endpointUrl"
      },
      "descriptionI18n": {
        "ko": "Bedrock OpenAI 호환 chat completions URL (리전별)."
      }
    },
    {
      "key": "apiKey",
      "type": "string",
      "label": "API Key",
      "description": "Bedrock-issued bearer token / API key.",
      "required": true,
      "secret": true,
      "mapsTo": {
        "target": "auth",
        "path": "apiKey"
      },
      "descriptionI18n": {
        "ko": "Bedrock에서 발급한 Bearer 토큰 / API 키."
      }
    },
    {
      "key": "modelId",
      "type": "string",
      "label": "Model ID",
      "description": "Bedrock model identifier.",
      "required": true,
      "mapsTo": {
        "target": "body",
        "path": "model"
      },
      "descriptionI18n": {
        "ko": "Bedrock 모델 ID."
      }
    },
    {
      "key": "temperature",
      "type": "number",
      "label": "Temperature",
      "min": 0,
      "max": 2,
      "step": 0.01,
      "mapsTo": {
        "target": "body",
        "path": "temperature"
      }
    },
    {
      "key": "top_p",
      "type": "number",
      "label": "Top P",
      "min": 0,
      "max": 1,
      "step": 0.01,
      "mapsTo": {
        "target": "body",
        "path": "top_p"
      }
    },
    {
      "key": "max_tokens",
      "type": "integer",
      "label": "Max Tokens",
      "min": 1,
      "max": 128000,
      "mapsTo": {
        "target": "body",
        "path": "max_tokens"
      }
    },
    {
      "key": "frequency_penalty",
      "type": "number",
      "label": "Frequency Penalty",
      "min": -2,
      "max": 2,
      "step": 0.01,
      "mapsTo": {
        "target": "body",
        "path": "frequency_penalty"
      }
    },
    {
      "key": "presence_penalty",
      "type": "number",
      "label": "Presence Penalty",
      "min": -2,
      "max": 2,
      "step": 0.01,
      "mapsTo": {
        "target": "body",
        "path": "presence_penalty"
      }
    },
    {
      "key": "stop",
      "type": "stringArray",
      "label": "Stop Sequences",
      "mapsTo": {
        "target": "body",
        "path": "stop"
      }
    }
  ],
  "uiSchema": {
    "groups": [
      {
        "id": "endpoint",
        "label": "Endpoint",
        "order": 1,
        "labelI18n": {
          "ko": "엔드포인트"
        }
      },
      {
        "id": "credentials",
        "label": "Credentials",
        "order": 2,
        "labelI18n": {
          "ko": "인증 정보"
        }
      },
      {
        "id": "model",
        "label": "Model",
        "order": 3,
        "labelI18n": {
          "ko": "모델"
        }
      },
      {
        "id": "generation",
        "label": "Generation",
        "order": 4,
        "labelI18n": {
          "ko": "생성"
        }
      }
    ],
    "fields": [
      {
        "key": "endpointUrl",
        "widget": "text",
        "visibility": "basic",
        "group": "endpoint",
        "order": 1,
        "placeholder": "https://bedrock-mantle.us-east-1.api.aws/v1/chat/completions"
      },
      {
        "key": "apiKey",
        "widget": "secret",
        "visibility": "basic",
        "group": "credentials",
        "order": 1
      },
      {
        "key": "modelId",
        "widget": "combobox",
        "visibility": "basic",
        "group": "model",
        "order": 1
      },
      {
        "key": "temperature",
        "widget": "slider",
        "visibility": "basic",
        "group": "generation",
        "order": 1
      },
      {
        "key": "max_tokens",
        "widget": "number-input",
        "visibility": "basic",
        "group": "generation",
        "order": 2
      },
      {
        "key": "top_p",
        "widget": "slider",
        "visibility": "advanced",
        "group": "generation",
        "order": 3
      },
      {
        "key": "frequency_penalty",
        "widget": "slider",
        "visibility": "advanced",
        "group": "generation",
        "order": 4
      },
      {
        "key": "presence_penalty",
        "widget": "slider",
        "visibility": "advanced",
        "group": "generation",
        "order": 5
      },
      {
        "key": "stop",
        "widget": "string-array",
        "visibility": "advanced",
        "group": "generation",
        "order": 6
      }
    ]
  },
  "capabilities": [
    "streaming",
    "reasoning",
    "vision",
    "tools"
  ],
  "sourceUrls": [
    "https://docs.aws.amazon.com/bedrock/latest/userguide/inference-chat-completions-mantle.html"
  ]
}